title;link;downloaded;notesTaken
"Autoconstruction d'une MOB : Projet de A à Z -  LPMDP #1";"https://www.youtube.com/watch?v=jUSpTudTqY4";false;false
"Comment trouver le terrain de vos rêves ?! -  LPMDP #2";"https://www.youtube.com/watch?v=ZSPmjv4yig0";false;false
"Comment faire son permis de construire ? (exemple concret) - LPMDP #3";"https://www.youtube.com/watch?v=5R3iRh7rFL0";false;false
"DIY Zéro déchet - Sac à fruits et légumes";"https://www.youtube.com/watch?v=Ja7C125dvz4";false;false
"Permis de construire raté.... - LPMDP #4";"https://www.youtube.com/watch?v=nOtW0DLSkgo";false;false
"Construire un abri de jardin (plan) - LPMDP #5";"https://www.youtube.com/watch?v=4tq5x3rw9YQ";false;false
"Abri de jardin - Timelapse Sketchup";"https://www.youtube.com/watch?v=5OeJj5v7_pg";false;false
"Aménagement de notre tiny house sans remorque (Sketchup) - LPMDP #6";"https://www.youtube.com/watch?v=-siPFS2P3ng";false;false
"Structure de notre MOB en détail - LPMDP #7";"https://www.youtube.com/watch?v=_vzJDfUsar8";false;false
"Achat de terrain : le suspens de la SAFER - LPMDP #8";"https://www.youtube.com/watch?v=i5x2pO1wQp0";false;false
"[VAN TOUR] Renault Master II transformé en fourgon aménagé - LPMDP #10";"https://www.youtube.com/watch?v=3zkWGQ7E5vA";false;false
"Présentation de notre terrain constructible - LPMDP #9";"https://www.youtube.com/watch?v=exyD3WXNwr4";false;false
"Planter une haie de cyprès - LPMDP #11";"https://www.youtube.com/watch?v=Ll_fX6dChv8";false;false
"Outils pour l'autoconstruction de notre tiny house - LPMDP #12";"https://www.youtube.com/watch?v=mBjRFa6YAmU";false;false
"Bois de construction : bien le choisir et le stocker - LPMDP #13";"https://www.youtube.com/watch?v=ErcGLttR8OA";false;false
"Fabrication d'un lève-murs - LPMDP #14";"https://www.youtube.com/watch?v=WenQjqWzgkk";false;false
"Comment faire les fondations d'un abris de jardin - LPMDP #15";"https://www.youtube.com/watch?v=TCnFude_UUE";false;false
"Vêtements de travail - LPMDP #16";"https://www.youtube.com/watch?v=PsdXOBKMm8U";false;false
"Fabrication d'un banc de sciage - LPMDP#18";"https://www.youtube.com/watch?v=AFwA8GAuTec";false;false
"Comment construire une dalle bois pour un abri de jardin - LPMDP#17";"https://www.youtube.com/watch?v=TrWaIoKBsSY";false;false
"Comment construire un abri de jardin en ossature bois - LPMDP #19";"https://www.youtube.com/watch?v=focn8NAlV58";false;false
"Comment faire un linteau sur un mur en ossature bois - LPMDP #20";"https://www.youtube.com/watch?v=Eou1htoxBK0";false;false
"Comment faire des murs en ossature bois pour une cabane de jardin ? - LPMDP #21";"https://www.youtube.com/watch?v=Nype8JqPliQ";false;false
"Pare-pluie et fixation : Comment faire les angles d'une ossature bois ? - LPMDP #22";"https://www.youtube.com/watch?v=IrhvDdPAMGE";false;false
"On transforme une fenêtre en porte ?! 🤔 - LPMDP #25";"https://www.youtube.com/watch?v=cfcJN-vAn-U";false;false
"Comment fabriquer un toit mono-pente en ossature bois ? - LPMDP #23";"https://www.youtube.com/watch?v=t4kgFPAWk1A";false;false
"Construire un abri de jardin : regarder ça AVANT de vous lancer ! - LPMDP #26";"https://www.youtube.com/watch?v=ZgNtZce054g";false;false
"Réussir l'implantation d'une construction - LPMDP #28";"https://www.youtube.com/watch?v=VYum3RqNoco";false;false
"Comment poser du bac acier pour le toit d'un abri de jardin ? - LPMDP #24";"https://www.youtube.com/watch?v=vJpRh6IdosY";false;false
"Terrassement d'un chemin d'accès - LPMDP #29";"https://www.youtube.com/watch?v=0D7O7-LBMoU";false;false
"Ils creusent les fondations de leur maison à LA MAIN ! - LPMDP #30";"https://www.youtube.com/watch?v=F__OQs6R_7w";false;false
"On a un truc à vous dire, et on est ravis ! - LPMDP #27";"https://www.youtube.com/watch?v=FRCgYBvkPTo";false;false
"Des angles droits à coup sûr ! - Méthode 3, 4, 5";"https://www.youtube.com/watch?v=BgxfjjojG1I";false;false
"Ferraillage pour plots en béton armé - LPMDP #31";"https://www.youtube.com/watch?v=BgwDu9ybnYI";false;false
"La petite MOB des Pingouins / Présentation du projet";"https://www.youtube.com/watch?v=sYBxWcjZ_cQ";false;false
"Semelles de fondation - LPMDP #32";"https://www.youtube.com/watch?v=z0BPUaZjH7A";false;false
"Réussir ses plots de fondation en béton armé - LPMDP #33";"https://www.youtube.com/watch?v=6906w7Q44_k";false;false
"Finitions des plots en béton armé -  LPMDP#34";"https://www.youtube.com/watch?v=iO3KMj9K2TE";false;false
"Concours 1000 abonnés ! en partenariat avec Würth Modyf";"https://www.youtube.com/watch?v=D-h4nVtyPNI";false;false
"Solivage et fonds de caissons dalle bois - LPMDP #36";"https://www.youtube.com/watch?v=5X22E5lpqfw";false;false
"Poutres maîtresses de la dalle bois - LPMDP #35";"https://www.youtube.com/watch?v=hu0bSTtpfag";false;false
"Résultats Concours 1000 abonnés  en partenariat avec Würth Modyf";"https://www.youtube.com/watch?v=_6_E766aTwA";false;false
"La petite MOB des Pingouins - Teaser";"https://www.youtube.com/watch?v=kCSe50udsoo";false;false
"Regards d'arrivée des réseaux et eaux usées - LPMDP #37";"https://www.youtube.com/watch?v=zzz1NVibRJQ";false;false
"Isolation de la dalle bois - LPMDP #38";"https://www.youtube.com/watch?v=sO0bumLansQ";false;false
"Pose du plancher en OSB - LPMDP #39";"https://www.youtube.com/watch?v=uZmgDJLNTPY";false;false
"Percer à la scie cloche sur un trou déjà fait - LPMDP #39 Bonus";"https://www.youtube.com/watch?v=6yjCupd7xSU";false;false
"Premier mur en ossature bois de la MOB - LPMDP #40";"https://www.youtube.com/watch?v=HesfGNiavqw";false;false
"Ossature bois du mur avec les fenêtres - LPMDP #41";"https://www.youtube.com/watch?v=ijFnwjaYmOc";false;false
"Cintreuse fer à béton DIY";"https://www.youtube.com/watch?v=wV2U8106tl4";false;false
"LE secret pour lever des murs avec contreventement intérieur - LPMDP #42";"https://www.youtube.com/watch?v=EQIT3sTzdWM";false;false
"Concours de Noël - Comme un Pingouin dans le désert";"https://www.youtube.com/watch?v=Nd_xgJG-_NM";false;false
"Derniers murs en ossature bois du rez de chaussée - LPMDP #43";"https://www.youtube.com/watch?v=L1E_u3664Jk";false;false
"Assemblage des murs de la MOB et des lisses de chaînage - LPMDP #44";"https://www.youtube.com/watch?v=MjkbTdzTqOY";false;false
"Construction d'une mezzanine : solivage avec étriers à queue d'aronde - LPMDP #45";"https://www.youtube.com/watch?v=bsCRL2bWuQA";false;false
"Plateau pyrogravé à partir de tasseaux de bois";"https://www.youtube.com/watch?v=3zDJdhwRIaI";false;false
"Plancher d'étage et finitions de la mezzanine - LPMDP #46";"https://www.youtube.com/watch?v=T1R8_pcvnTQ";false;false
"Bâche pendant la construction bois -  LPMDP #47";"https://www.youtube.com/watch?v=JpCI30XImaM";false;false
"Bêtisier de Noël - LPMDP";"https://www.youtube.com/watch?v=3-EcL3IwIhM";false;false
"Vlog #1 -  Bonne année, FAQ, Autonomie, Permaculture, Apiculture";"https://www.youtube.com/watch?v=5tciY3ywRgY";false;false
"Murs en ossature bois de l'étage - LPMDP #48";"https://www.youtube.com/watch?v=v0Sb-VbTzMA";false;false
"Assemblage et contreventement des murs en ossature bois de l'étage - LPMDP #49";"https://www.youtube.com/watch?v=SJNBd7ty4Ko";false;false
"Ossature du toit monopente - LPMDP #50";"https://www.youtube.com/watch?v=FDpONawGCGI";false;false
"Pare-pluie rigide sur la toiture, ça tourne mal - LPMDP #51";"https://www.youtube.com/watch?v=OkIROY0DrWk";false;false
"Vivre en autonomie - Objectifs et Motivations";"https://www.youtube.com/watch?v=GnoaRZIk6P0";false;false
"Vlog #2 - Spoiler alert, FAQ et Eurobois";"https://www.youtube.com/watch?v=Os49T2ZJ7dA";false;false
"Vivre en autonomie - Bilan année 1 [2017]";"https://www.youtube.com/watch?v=FJA598OLrcs";false;false
"Pose du bacacier en toiture - LPMDP #52";"https://www.youtube.com/watch?v=ufDGaRWHBvQ";false;false
"[Live] FAQ des Pingouins - On répond à vos questions";"https://www.youtube.com/watch?v=Dnk2wnvRAt8";false;false
"Isolation en fibre de bois et pare pluie rigide - LPMDP#53";"https://www.youtube.com/watch?v=fBChUADNhEM";false;false
"Finitions du pare pluie rigide - LPMDP #54";"https://www.youtube.com/watch?v=9b6EMQm1nDc";false;false
"MOB industrielles et belles machines - Eurobois 2018";"https://www.youtube.com/watch?v=9xxVWg5kD5U";false;false
"Nous soutenir ? - Vlog #3";"https://www.youtube.com/watch?v=y3rKHNET1OA";false;false
"Préparation du tableau de fenêtre - LPMDP #55";"https://www.youtube.com/watch?v=ZEw9-3bZxpc";false;false
"Poser une fenêtre en tunnel sur ossature bois - LPMDP #56";"https://www.youtube.com/watch?v=y0_2_ozHHZk";false;false
"Montage du cadre de la baie vitrée - LPMDP #57";"https://www.youtube.com/watch?v=0jEGw_oC1IA";false;false
"Pose de la baie vitrée alu en tunnel - LPMDP #58";"https://www.youtube.com/watch?v=E1lZ4pJqBnk";false;false
"Premiers semis - LJDP #2";"https://www.youtube.com/watch?v=YiJweZdHnZ4";false;false
"Potager et permaculture : notre philosophie - LJDP #1";"https://www.youtube.com/watch?v=CqEwW7jMSec";false;false
"Finitions du bacacier : rives, faîtage, aérations - LPMDP #59";"https://www.youtube.com/watch?v=0SaKdzebOdU";false;false
"Installation de la gouttière - LPMDP #60";"https://www.youtube.com/watch?v=QjOFDaFdiK4";false;false
"Support de mugs DIY en bois";"https://www.youtube.com/watch?v=bvCnIJfBX7k";false;false
"Isolation thermique du toit en fibre de bois - LPMDP #61";"https://www.youtube.com/watch?v=nCBvyoVInhM";false;false
"5 Astuces de chantier en autoconstruction - LPMDP Bonus";"https://www.youtube.com/watch?v=wuqDu0EyB6w";false;false
"Potalive #1 - Visite de notre installation au potager et premiers retours";"https://www.youtube.com/watch?v=5dgI7ZJi0RM";false;false
"Détecter les ponts thermiques d'une maison grâce à la caméra thermique - LPMDP #62";"https://www.youtube.com/watch?v=YJ_CqS_IWAc";false;false
"Ce que révèle une caméra thermique dans une vielle maison - LPMDP #62 Bonus";"https://www.youtube.com/watch?v=dxp5PzKhHgM";false;false
"Sécurité et vêtements de travail - LPMDP Bonus";"https://www.youtube.com/watch?v=gCFAM2wh4a4";false;false
"Fabrication d'un abri pour le bois - LPMDP #63";"https://www.youtube.com/watch?v=_PLU2mQTvX0";false;false
"Nouveaux Pingouins, concours 20 000 abonnés, changement de musique - Vlog #4";"https://www.youtube.com/watch?v=dPgyMdoVWbg";false;false
"Fabrication d'une passerelle sur muralière - LPMDP #64";"https://www.youtube.com/watch?v=ULVCAW5CMAQ";false;false
"Astuce travaux mezzanine : plancher provisoire - LPMDP #65";"https://www.youtube.com/watch?v=sfCs9893P4I";false;false
"Contreventement toiture monopente - LPMDP #66";"https://www.youtube.com/watch?v=lrvM8fy0WZY";false;false
"1 an d'autoconstruction, visite de chantier - LPMDP Bonus";"https://www.youtube.com/watch?v=1_TadjsrTqg";false;false
"Contreventement et arrachement MOB - Erreurs à éviter - LPMDP #67";"https://www.youtube.com/watch?v=5EknwcbEJoo";false;false
"Contreventement et arrachement MOB - Réparation de nos erreurs - LPMDP #68";"https://www.youtube.com/watch?v=XRhy4pKdTK8";false;false
"Visite de Potager Juillet - Potalive #2";"https://www.youtube.com/watch?v=qQpAPBYCWTY";false;false
"Départ du bardage bois et grilles anti-rongeur - LPMDP #69";"https://www.youtube.com/watch?v=ZHenPzG97RE";false;false
"Pose bardage bois en Douglas hors aubier - LPMDP #70";"https://www.youtube.com/watch?v=BtkcCbwcPqE";false;false
"Bardage bois et contours des fenêtres - LPMDP #71";"https://www.youtube.com/watch?v=fIvRtimlbW0";false;false
"Huile de finition pour bardage bois - LPMDP #72";"https://www.youtube.com/watch?v=q2H78aTE-HQ";false;false
"Sous faces de toiture en aluminium - LPMDP #73";"https://www.youtube.com/watch?v=C93rniyAplc";false;false
"Fabrication d'une ruche et récupération d'un essaim - LADP #2";"https://www.youtube.com/watch?v=hGw0oNutUvk";false;false
"Merci beaucoup les Pingouins !";"https://www.youtube.com/watch?v=E0E06Ad-u8Y";false;false
"Apiculture : notre philosophie - LADP #1";"https://www.youtube.com/watch?v=3xAaeS5Rm2U";false;false
"Finitions des rives de toiture et cornières du bardage en aluminium - LPMDP #74";"https://www.youtube.com/watch?v=ZQbLmW0cn9E";false;false
"Fabriquer une lampe en 2h - Défis makers #UltimateDefi";"https://www.youtube.com/watch?v=S4eA6DVcH7U";false;false
"[Live OFF] Résultat du Concours des 20.000 abonnés";"https://www.youtube.com/watch?v=yrh3vyKjPjE";false;false
"Conseils d'un apiculteur pour débuter l'apiculture - LADP #3";"https://www.youtube.com/watch?v=ANNppI719PA";false;false
"Les meilleurs livres d'apiculture - LADP #4";"https://www.youtube.com/watch?v=70K1akc8wDY";false;false
"Finitions extérieures des fenêtres en aluminium - LPMDP #75";"https://www.youtube.com/watch?v=9ab7Ib_ANO4";false;false
"Plieuse à tôle rapide et pas cher - LPMDP #75 Bonus";"https://www.youtube.com/watch?v=NFLCjmHH2Yg";false;false
"Pose de volet roulant coffre non apparent sur une MOB - LPMDP #76";"https://www.youtube.com/watch?v=9tDMpi4oimM";false;false
"Grilles d'aération des sous faces et insectes volants - LPMDP #73 Bonus";"https://www.youtube.com/watch?v=3QfjbUkGa48";false;false
"Seuil de baie vitrée sur dalle bois - LPMDP #77";"https://www.youtube.com/watch?v=wG-7Hds2XtU";false;false
"Visite de potager hivernal / automnal Octobre - Potalive #3";"https://www.youtube.com/watch?v=cHD_ezL-000";false;false
"Construire un escalier d'extérieur - LPMDP #78";"https://www.youtube.com/watch?v=5LlpZH91tUI";false;false
"Plein de changements pour la suite ! - Vlog #5";"https://www.youtube.com/watch?v=GHPQdG82hZs";false;false
"Conseils autoconstruction #1 - Les outils";"https://www.youtube.com/watch?v=4id4fS3gndc";false;false
"Comment organisation un chantier ? - Conseils autoconstruction #2";"https://www.youtube.com/watch?v=EL0d0T72XVY";false;false
"Rester motiver sur un chantier - Conseils autoconstruction #3";"https://www.youtube.com/watch?v=BX0IBwElpOo";false;false
"Comment organiser son autoconstruction avec son travail - Journée TOP";"https://www.youtube.com/watch?v=wygONhbv8mM";false;false
"Journée type d'un autoconstructeur";"https://www.youtube.com/watch?v=7StgBnSK468";false;false
"Comment NE PAS organiser sa journée d'autoconstruction - Journée FLOP";"https://www.youtube.com/watch?v=V0Hq1E7mvsA";false;false
"Bruit de la pluie sur le bacacier, agrandissement et cuisine aménagé - RDV Pingouins #1";"https://www.youtube.com/watch?v=mG9fDznYw3c";false;false
"Quel budget pour une maison en autoconstruction ? VS artisans - Conseils autoconstruction #4";"https://www.youtube.com/watch?v=dZFrdRSbfDU";false;false
"Quels matériaux choisir pour la construction d'une maison - Conseils d'autoconstruction #5";"https://www.youtube.com/watch?v=QnKVnYLagFY";false;false
"Nos erreurs d'autoconstructeurs et nos choix techniques - Conseils d'autoconstruction #6";"https://www.youtube.com/watch?v=zvTIQ4lnLGk";false;false
"UN COUPLE D'INFORMATICIENS CONSTRUIT UNE MAISON EN BOIS !!";"https://www.youtube.com/watch?v=8iL8mlTTzHc";false;false
"Autoconstruction d'une maison en ossature bois en un claquement de doigts";"https://www.youtube.com/watch?v=PE7tWBDFeuc";false;false
"Tente de stockage - LPMDP S2#1";"https://www.youtube.com/watch?v=zfWpZphUNYs";false;false
"Joyeux Noël les Pingouins - Vlog #6";"https://www.youtube.com/watch?v=Z9ZuhyO-CBs";false;false
"Quelles solutions de stockage sur un chantier ? - LPMDP S2#1 Bonus";"https://www.youtube.com/watch?v=Q0DWFNLx8PY";false;false
"Le Youtube Rewind des Makers Francophones - 2018";"https://www.youtube.com/watch?v=KTIRdiIpkCk";false;false
"On répond à TOUTES vos questions - Le RDV des Pingouins";"https://www.youtube.com/watch?v=HUSOar5d_eI";false;false
"Calcul des charges, avoir des partenariats et maison de plain-pied  - RDV Pingouins #2";"https://www.youtube.com/watch?v=aXp6i18OSmU";false;false
"Vivre en autonomie - Bilan année 2 [2018]";"https://www.youtube.com/watch?v=KD9-HeDGq3o";false;false
"Isolation de toiture par l'intérieur en fibre de bois - LPMDP S2#2";"https://www.youtube.com/watch?v=F8JoVEf2-hc";false;false
"Maison en bois & incendie, plans 3D, VMC et comment on gagne notre vie - RDV Pingouins #3";"https://www.youtube.com/watch?v=ZqG1A4Yc3U4";false;false
"Travaux intérieurs - LPMDP Saison 2 - Teaser";"https://www.youtube.com/watch?v=U3chimvN4f0";false;false
"Frein vapeur ou pare vapeur, à quoi ça sert ? - LPMDP S2#3";"https://www.youtube.com/watch?v=hYaetQ3Q2H8";false;false
"Pose du frein vapeur et recoins particuliers - LPMDP S2#4";"https://www.youtube.com/watch?v=PXbaCGCqkbQ";false;false
"Comment installer des fausses poutres décoratives - LPMDP S2#5";"https://www.youtube.com/watch?v=hfk9Z--U8zc";false;false
"Doubler l'isolation d'un mur avec la laine de bois - LPMDP S2 #6";"https://www.youtube.com/watch?v=wWp01DFnsJg";false;false
"Lambris, parquet massif et poutres apparentes : nos choix pour l'intérieur - LPMDP S2 #7";"https://www.youtube.com/watch?v=Xssg6tS4gtg";false;false
"Comparer les devis, isolation phonique, travertin et parquet massif - RDV Pingouins #4";"https://www.youtube.com/watch?v=-h8LCK2hoV8";false;false
"Dégoutés de l'autoconstruction, écrire un livre et stikers Pingouin - RDV Pingouins #5";"https://www.youtube.com/watch?v=mkjEUx6sSvg";false;false
"Fixer un poteau en bois sous une poutre déjà en place - LPMDP S2 #8";"https://www.youtube.com/watch?v=FRD0mrRKMZ0";false;false
"On a enfermé des YouTubers Makers dans un maillet qui parle - #hammerchallenge";"https://www.youtube.com/watch?v=dwr7oA5tNTc";false;false
"Fabriquer une chope en 3 Heures et avec 3 Matières - #UltimateDefi2";"https://www.youtube.com/watch?v=jvbwlR1m_GU";false;false
"Cloison intérieure en ossature bois - LPMDP S2 #9";"https://www.youtube.com/watch?v=cSVVstVSySQ";false;false
"Installer une GTL sur de l'OSB - LPMDP S2 #10";"https://www.youtube.com/watch?v=5cTIsr8LjdY";false;false
"[Live] /!\ SPOILER dans ce direct ! On réponds à vos 50000 questions en direct";"https://www.youtube.com/watch?v=7vgvX8FF6Ns";false;false
"Chassis à semis, blé avec la méthode Bonfils et visite du potager Printemps 2019 - Potalive #4";"https://www.youtube.com/watch?v=kGY2KeCaijE";false;false
"Passage des gaines électriques dans une ossature bois - LPMDP S2 #11";"https://www.youtube.com/watch?v=QRj2CGD_7Nk";false;false
"8 chaînes youtube sur l'autonomie énergétique et alimentaire";"https://www.youtube.com/watch?v=TrGwAbdPqtc";false;false
"Vivre en autonomie, c'est quoi pour vous ? - Projets autonomes #1";"https://www.youtube.com/watch?v=N3jbz4RakMU";false;false
"8 raisons de devenir autonome - Projets autonomes #2";"https://www.youtube.com/watch?v=xG7I6RS31XA";false;false
"La vie en autonomie, c'est pas si simple - Projets autonomes #3";"https://www.youtube.com/watch?v=WkAqVG9WKiQ";false;false
"Passer les câbles et fils électriques dans des gaines déjà posées - LPMDP S2 #12";"https://www.youtube.com/watch?v=WieKGOPMw8g";false;false
"2 ans de chantier et notre petite maison n'est toujours pas finie ?!";"https://www.youtube.com/watch?v=J0ytyryX2_I";false;false
"Pois mange tout ou petit pois, telle est la question - Visite du potager Juin 2019 - Potalive #5";"https://www.youtube.com/watch?v=vC2xX3hL5_Y";false;false
"Installer des tapées de finition sur une fenêtre aluminium - LPMDP S2 #13";"https://www.youtube.com/watch?v=gbzXw-ljSFY";false;false
"Panneaux solaires : autoconsommation ou autonomie ?";"https://www.youtube.com/watch?v=6Wz74bsj3Dc";false;false
"Tondeuse manuelle VS Tondeuse thermique";"https://www.youtube.com/watch?v=NVVrL9h5RHc";false;false
"🦊 Fabriquer un renard en métal et en ÉPONGE - #UltimateDefi2 FAIL";"https://www.youtube.com/watch?v=LrGKlPyCzkc";false;false
"Ils construisent un château avec les techniques du 13ème siècle - Guédelon";"https://www.youtube.com/watch?v=niAUjRhsIUs";false;false
"Poser du lambris bois avec des crochets de fixation - LPMDP S2 #14";"https://www.youtube.com/watch?v=18BB-yGQxWI";false;false
"Astuces pour poser un lambris bois au mur - LPMDP S2 #15";"https://www.youtube.com/watch?v=L0XxPh8voag";false;false
"Découpes galères du lambris autour des fenêtres et des poutres - LPMDP S2 #16";"https://www.youtube.com/watch?v=k-xV4LqxPWw";false;false
"8 techniques pour être fier de ses travaux";"https://www.youtube.com/watch?v=dBbOEv_4f4Q";false;false
"Poser du lambris bois au plafond - LPMDP S2 #17";"https://www.youtube.com/watch?v=Exbm8kt3hnY";false;false
"On construit une passerelle au dessus du vide ! - LPMDP S2 #18";"https://www.youtube.com/watch?v=vWAFedyk9ss";false;false
"Ce que vous ignorez sur les vis à bois !";"https://www.youtube.com/watch?v=BSOrW23N3Xk";false;false
"Ne cliquez pas sur cette vidéo... si vous n'aimez pas les partenariats [⚠concours terminé⚠]";"https://www.youtube.com/watch?v=UdjJ-vvV4GQ";false;false
"Hiver dans notre maison en bois (chaleur et humidité), évolution de la chaîne, questions [live OFF]";"https://www.youtube.com/watch?v=I7M4Sehl55s";false;false
"Poser du parquet massif - LPMDP S2 #19";"https://www.youtube.com/watch?v=4Be9fX1OUkg";false;false
"Fabriquer soi-même des plinthes - LPMDP S2 #19 Bonus";"https://www.youtube.com/watch?v=vI0ua81o8Tc";false;false
"Tirage Au Sort Concours 50 000 PINGOUINS";"https://www.youtube.com/watch?v=63fGfefi7Rc";false;false
"Comment faire les finitions d'un parquet et d'un lambris - LPMDP S2 #20";"https://www.youtube.com/watch?v=vBLCJsqtTEs";false;false
"Fabriquer son lit CODODO soit-même - DIY 👶";"https://www.youtube.com/watch?v=TNzUGY8B9Mk";false;false
"5 Outils qui nous auraient CHANGÉ LA VIE - LIVE Batimat 2019";"https://www.youtube.com/watch?v=H7DvMq1Xk5I";false;false
"On emménage dans 16m² ! 😮 - LPMDP S2 #21";"https://www.youtube.com/watch?v=z99qRz5IfHw";false;false
"Ce que vous ignorez sur votre mètre !";"https://www.youtube.com/watch?v=72j6equlIpw";false;false
"On installe un hamac géant dans notre maison !! 😍 - LPMDP S2 #22";"https://www.youtube.com/watch?v=led8_RWwTWQ";false;false
"Les SECRETS pour des mesures ULTRA PRÉCISES !";"https://www.youtube.com/watch?v=36Ssik2sDQ0";false;false
"DIY garde-corps style industriel - LPMDP S2 #23";"https://www.youtube.com/watch?v=1vvFar_NYVU";false;false
"Maison en container, Couple et autoconstruction, Écoconstruction terre/paille, normes VRD [Live OFF]";"https://www.youtube.com/watch?v=lFfs9TXriEM";false;false
"1 an de travaux TRANSFORMATION - LPMDP S2";"https://www.youtube.com/watch?v=5wRry8ETxIE";false;false
"L'installation solaire PARFAITE ?!";"https://www.youtube.com/watch?v=h7wkOmLt4hw&t=19s";false;false
"Viabiliser un terrain : Comment avoir l'eau et l'électricité sur son terrain ? - LPMDP S2 #24";"https://www.youtube.com/watch?v=eE7r_yFikD4";false;false
"Construction regard en béton pour l'arrivée des réseaux VRD d'une habitation - LPMDP S2 #25";"https://www.youtube.com/watch?v=JZ9CuPvYMM4";false;false
"Débutants à la mini-pelle : on creuse une énorme tranchée pour nos VRD ! - LPMDP S2 #26";"https://www.youtube.com/watch?v=b-ipn0zIy3E";false;false
"Tranchée de raccordement : Passage des gaines pour les réseaux - LPMDP S2 #27";"https://www.youtube.com/watch?v=Jw-l5F9yf90";false;false
"Confinement, autonomie alimentaire, télétravail et vélo électrique [live OFF]";"https://www.youtube.com/watch?v=4MKzqfDWUwM";false;false
"Raccordement au tout à l'égout avec pompe de relevage - LPMDP S2 #28";"https://www.youtube.com/watch?v=kWiV8SJ2x2g";false;false
"Installation d'une pompe de relevage pour le tout à l'égout - LPMDP S2 #29";"https://www.youtube.com/watch?v=bMZZiBCRULk";false;false
"Vivre en autonomie, est-ce vraiment possible ? - Bilan année 3 [2019]";"https://www.youtube.com/watch?v=4qvHeYX37tg";false;false
"Comment on va faire pour éclairer notre vide de mezzanine ?! - LPMDP S2 #30";"https://www.youtube.com/watch?v=RuX7AWEafwY";false;false
"Comment choisir ses spots leds ? Lumens, Lux, Kelvin - LPMDP S2 #31";"https://www.youtube.com/watch?v=DmK_lgCJBeI";false;false
"Vivre dans une maison en travaux : la fausse bonne idée ?!";"https://www.youtube.com/watch?v=Qlce7cUE3lE";false;false
"Plafond de salle de bain : les erreurs à éviter - LPMDP S2 #32";"https://www.youtube.com/watch?v=oEpvfKXhnOs";false;false
"Faire une douche à l'italienne sur plancher BOIS - LPMDP S2 #33";"https://www.youtube.com/watch?v=wj-atvr2R0w";false;false
"Comment maçonner un bac en mortier pour une douche à l'italienne ! - LPMDP S2 #34";"https://www.youtube.com/watch?v=mBS0betW-Z0";false;false
"Natte d'étanchéité, désolidarisation, SEL/SPEC, bac maçonné, receveur à carreler CHOIX SALLE DE BAIN";"https://www.youtube.com/watch?v=Mcj3rjpTfxs";false;false
"Comment être le mieux préparé possible pour ses travaux + DTU + Assurance Autoconstruction ?";"https://www.youtube.com/watch?v=Arz7IfUGyzw";false;false
"Natte d'étanchéité et désolidarisation : Réussir une salle de bain sur support bois - LPMDP S2 #35";"https://www.youtube.com/watch?v=dji_5hqh46c";false;false
"ON CONSTRUIT NOTRE DOUCHE ! en panneaux étanches - LPMDP S2 #36";"https://www.youtube.com/watch?v=5mur8UB7Zis";false;false
"On pose de la pierre naturelle dans notre salle de bain - LPMDP S2 #37";"https://www.youtube.com/watch?v=E-H1qDOffSM";false;false
"On arrête YouTube...";"https://www.youtube.com/watch?v=ZkOTRwZbQK8";false;false
"Travaux et burnout...";"https://www.youtube.com/watch?v=c1MSwpnNhIw";false;false
"Projets 2021, Argent et PUB, Nouvelles de Salomé...";"https://www.youtube.com/watch?v=qeFB_S8ouaU";false;false
"On continue ENFIN la salle de bain en travertin !  - LPMDP S2 #38";"https://www.youtube.com/watch?v=RD3vxQ9wwfg";false;false
"Platine de douche : l'erreur à ne pas faire ! - LPMDP S2 #39";"https://www.youtube.com/watch?v=41N0pMio_EE";false;false
