title;link;downloaded;notesTaken
"fabriquer son éolienne et générateur / homemade wind turbine and generator";"https://www.youtube.com/watch?v=Kc_2704jFPE";false;false
"Ep 1 : Fabriquer 3 types de poele rocket / 3 Homemade rocket stoves";"https://www.youtube.com/watch?v=VCZSR3CFn8U";false;false
"Ep 2 : Incroyable rocket stove / Aluminum Furnace with dead leaves";"https://www.youtube.com/watch?v=FTezJ1kdZ6U&t=12s";false;false
"Ep 3 : Fonderie pour débutant / rocket stove - furnace aluminum melting";"https://www.youtube.com/watch?v=nDGz5GbfN3w";false;false
"Ep 4: Comment faire de la thermoélectricité avec un module peltier ?";"https://www.youtube.com/watch?v=GVpPmu6S_Dk";false;false
"Ep 5: Fabriquer son chauffe eau / Homemade water heater";"https://www.youtube.com/watch?v=_-4__gCwIHk";false;false
"Projet pilote à Voiron  - fonderie à l'école primaire";"https://www.youtube.com/watch?v=UPQZb_jnTDA";false;false
"Ep6: Comment sécher des pommes gratuitement. Manger sain.";"https://www.youtube.com/watch?v=xGk3Fuk5EBQ";false;false
"Ep7:  What else... for haloween";"https://www.youtube.com/watch?v=VXrAoLlZtKI";false;false
"Ep8 - 1/3- Four à pain, pizza...gratuit / free homemade wood fired pizza/bread oven";"https://www.youtube.com/watch?v=WfD7FU8id68";false;false
"Ep8  -2/3 - Préparer mon argile, ma poterie et la cuire /Preparing clay, making pottery and  firing";"https://www.youtube.com/watch?v=IZhCcAhtqTc";false;false
"Ep 8 -3/3-  Fabriquer des émaux et les fondre avec énergie gratuite / Prepare an enamel and melt it";"https://www.youtube.com/watch?v=nJIt7Fc2-VY";false;false
"Ep 9: fonderie à la cire perdu";"https://www.youtube.com/watch?v=bswZIemHGsU";false;false
"Ep 10:  Eolienne, le retour / Wind turbine, the come back";"https://www.youtube.com/watch?v=cpKIpPKyQZI";false;false
"Ep 11: Éolienne 3D en aluminium / 3D aluminum wind turbine";"https://www.youtube.com/watch?v=PsijcLWaKGM";false;false
"Ep12: Générateur éolienne 50 watts en PVC  / wind turbine generator 50w";"https://www.youtube.com/watch?v=SnSuCofiNcA";false;false
"Ep14 : Rocket stove, le retour";"https://www.youtube.com/watch?v=V0XwlSjxWuc";false;false
"Un peu de chaleur pour l'hiver...";"https://www.youtube.com/watch?v=EwHK-W8bakQ";false;false
"Ep15: Comment faire une galette sans pétrole / How to make a pancake without oil";"https://www.youtube.com/watch?v=siSZfZUKP-g";false;false
"Ep16: Plan poele dragon multicombustible sans soudure /  wood or pellets rocket stove drowing";"https://www.youtube.com/watch?v=R6pm-TD0P84";false;false
"Ep17 Chauffer sa "piscine" avec un rocket stove / water heater with rocket stove";"https://www.youtube.com/watch?v=hIccNZVX6X8";false;false
"Ep 18: Transition énergétique vol. 1 /  energetic transition part.1";"https://www.youtube.com/watch?v=xNul4pTbpTU";false;false
"Ep 22: J'ai fait ma chaussure avec un pneu Michelin 1/2";"https://www.youtube.com/watch?v=fDhHBnDmTs0";false;false
"Ep 23:  Sandale pneu Goodyear 2/2";"https://www.youtube.com/watch?v=MiARib7GdwI";false;false
"Ep19: Transition énergétique d'un enfant vol.2 /Energy transition of a child";"https://www.youtube.com/watch?v=H45LZZRkR8Q";false;false
"Transition énergétique d'une yourte: Episode 20";"https://www.youtube.com/watch?v=vXptoJ6EJPg";false;false
"Ep24: Remorque à vélo.";"https://www.youtube.com/watch?v=Iuan23roClc";false;false
"Petit défi pour les 50 000 abonnés de Barnabé Chaillot";"https://www.youtube.com/watch?v=6j04J0EbKLQ";false;false
"Ep 25 : fan de carotte";"https://www.youtube.com/watch?v=1GR81MWrgXo";false;false
"Ep26: POLENTA pour bricoleur autonome survivaliste.  Version courte";"https://www.youtube.com/watch?v=8736Sgz65pE";false;false
"Ep27: Polenta du jardin";"https://www.youtube.com/watch?v=ZPxB1EpBses";false;false
"l'association l'énergie autrement";"https://www.youtube.com/watch?v=6tuWPvUBb9U";false;false
"Ep 28: Cuisiner autrement avec un poele dragon";"https://www.youtube.com/watch?v=80PX9T_9xIE";false;false
"Ep29  Biathlon, l'envers de la médaille ...";"https://www.youtube.com/watch?v=vPGTID3Tep0";false;false
"Quinoa du Jardin : Semer, Cultiver, Récolter, Préparer et en Manger";"https://www.youtube.com/watch?v=zJgpqIB1Q0w";false;false
"Stop Pub";"https://www.youtube.com/watch?v=9QvrOhu2y1c";false;false
"Eau de pluie dans les WC";"https://www.youtube.com/watch?v=kXVqazu-12g";false;false
"L'Energie Autrement c'est quoi?";"https://www.youtube.com/watch?v=BMPd7fTzqFU";false;false
"Ep31: Produire et partager son électricité pendant 20 ans";"https://www.youtube.com/watch?v=hj_SVJO840M";false;false
"Quelques animaux du jardin";"https://www.youtube.com/watch?v=x9c_LWevHcY";false;false
"25 ans d'electricité gratuite sans réseau et sans batterie";"https://www.youtube.com/watch?v=_a63njvv1P8";false;false
"Vélo électrique Solaire. Transport gratuit";"https://www.youtube.com/watch?v=w6V8lTJ-d8w";false;false
"Le meilleur placement financier de l'année";"https://www.youtube.com/watch?v=OyZJZzHTL_s";false;false
"Energie Solaire . Vendre, Stocker ou Consommer? par Barnabé";"https://www.youtube.com/watch?v=c9DsZWMt_Oo";false;false
"Energie Solaire : Autoconsommation avec Arduino par Barnabé #2";"https://www.youtube.com/watch?v=iks4qLBp9vg";false;false
"Réussir 80% d'autoconsommation photovoltaïque (sans batterie) #3";"https://www.youtube.com/watch?v=jnuNzXcd_g8&t=583s";false;false
"Douche avec panneaux photovoltaïques #4";"https://www.youtube.com/watch?v=KKvaQzRbkA8";false;false
"Tout sur l'autoconsommation photovoltaique #5";"https://www.youtube.com/watch?v=jieIqrAOqo8";false;false
"Je bois mon eau de pluie :)";"https://www.youtube.com/watch?v=9ooBy1MuVoE";false;false
"De l'électricité mais sans facture";"https://www.youtube.com/watch?v=FUGjoPsZTUQ";false;false
"Effondrement, Recette biscuit facile noël";"https://www.youtube.com/watch?v=84hbZWlILic";false;false
"Châtaignes: cuire, éplucher, conserver, sécher et moudre";"https://www.youtube.com/watch?v=BQqIjK_mzdI";false;false
"Galette de sarrasin sans électricité avec pesto d'ortie et noix";"https://www.youtube.com/watch?v=-siM1AVqB2g";false;false
"Comment avoir de la farine à volonté ? /How to have unlimited flour ?";"https://www.youtube.com/watch?v=DxhKPOQmyzQ";false;false
"Comment avoir du pain et levain à volonté / How to have bread and yeast at will";"https://www.youtube.com/watch?v=10mnjQsYwr0";false;false
"Biscuits 3D à volonté";"https://www.youtube.com/watch?v=Rru52nnqAxM";false;false
"10 recettes pour manger le maïs de son jardin / 10 ways to cook your corn";"https://www.youtube.com/watch?v=24WrDyfFsY8";false;false
"100% Autonome un rêve à portée de main.";"https://www.youtube.com/watch?v=zLWCootfQ64";false;false
"Fibre local pour attacher ses tomates...  et plus si affinités";"https://www.youtube.com/watch?v=lYogFp5CmSs";false;false
"Charger son téléphone avec un panneau solaire / how to charge your phone with a solar panel";"https://www.youtube.com/watch?v=iheZQVeH6lA";false;false
"Comment stocker de l'électricité dans le lithium de nos poubelles";"https://www.youtube.com/watch?v=_hwj7Ds50lU";false;false
"Comment faire un bureau dans sa voiture.";"https://www.youtube.com/watch?v=piT0C0HOt9s";false;false
"Rêvons ensemble des voitures du futur";"https://www.youtube.com/watch?v=McFqG0Hkm0E";false;false
"Comment transformer mon motoculteur en "voiture"";"https://www.youtube.com/watch?v=3ween8uUBAg";false;false
"Casse noisette pro à imprimer chez soi.";"https://www.youtube.com/watch?v=CLUU20uA4Xc";false;false
"Comment moudre des céréales avec le soleil, sans batterie, sans réseau.";"https://www.youtube.com/watch?v=3R9xI8YFy3w";false;false
"Cuisiner sans gaz / cooking without gas";"https://www.youtube.com/watch?v=l0fIm8gMbTg&t=365s";false;false
"Pourquoi Barnabé Chaillot ne fait plus de vidéo ?";"https://www.youtube.com/watch?v=shDxHwS4H5s&t=270s";false;false